{
  "scene": "职业规划",
  "purpose": "女生专属大数据本科全周期发展规划，数学学硕主线+公派留学核心+教资/考公/就业全兜底",
  "audience": "自己/导师/家人",
  "cover": {
    "title": "女生专属·大数据本科全周期发展规划",
    "subtitle": "数学学硕主线 + 公派留学核心 + 全兜底路径",
    "reporter": "个人职业规划",
    "period": "2026-2032"
  },
  "sections": [
    {
      "key": "self_analysis",
      "name": "自我分析与核心定位",
      "items": [
        {
          "title": "学业禀赋复盘",
          "desc": "大一绩点3.86/4.0，专业前7.4%，加权前3.7%；微积分双96、Java97、数据结构92，数学+编程双顶尖"
        },
        {
          "title": "核心诉求匹配",
          "desc": "主攻0701数学学硕避开内卷；数学类是公考招录大户；CSC公派优先级最高学科"
        },
        {
          "title": "女生专属考量",
          "desc": "规避过度内卷赛道，优先高稳定性岗位，全程控制经济成本，安全与发展平衡"
        }
      ]
    },
    {
      "key": "career_goal",
      "name": "职业目标与赛道选择",
      "items": [
        {
          "title": "主线：公派读博长期跃升",
          "desc": "国内211数学学硕→校际合作CSC项目，零学费+生活费补贴，不花家里一分钱"
        },
        {
          "title": "兜底一：体制内考公",
          "desc": "数学类岗位覆盖税务、统计局、发改委，竞争远小于计算机类、三不限岗位"
        },
        {
          "title": "兜底二：公办教师编",
          "desc": "数学学硕+教资，初高中数学教师、中职教研，稳定且社会认可度高"
        },
        {
          "title": "兜底三：国企/金融风控",
          "desc": "银行风控、央企算法、军队文职，薪资可观且加班强度低于互联网大厂"
        }
      ]
    },
    {
      "key": "action_plan",
      "name": "分阶段落地执行规划",
      "items": [
        {
          "title": "大二·基础奠基期",
          "desc": "数分高代教材一轮精读+英语长线补短板；低成本参加数学竞赛、大创项目攒素材"
        },
        {
          "title": "大三·强化分化期",
          "desc": "确定三层志愿梯队(985冲刺/211稳妥/双非保底)；拿下高中数学教资；竞赛出成果"
        },
        {
          "title": "大四·冲刺落地期",
          "desc": "考研全科冲刺模拟+一志愿锁定；初试后立即复试复习；并行省考春招兜底零gap过渡"
        },
        {
          "title": "硕士·公派攻坚期",
          "desc": "研一稳绩点拿奖学金+启动雅思；研二产出学术成果+雅思6.5；研三提交CSC申请+国内博兜底"
        },
        {
          "title": "博士·成熟跃升期",
          "desc": "CSC资助海外博士；毕业回国进高校任教/科研院所/大厂算法专家，完成阶层跃升"
        }
      ]
    },
    {
      "key": "risk_assessment",
      "name": "风险兜底与女生建议",
      "items": [
        {
          "title": "考研失利兜底",
          "desc": "初试结束立即备战省考+春招数据岗+教资认定，最差当年入职稳定岗位不空档"
        },
        {
          "title": "CSC申请失利兜底",
          "desc": "转国内硕博连读5年拿博士，培养成本极低；或放弃读博直接入职体制内/国企风控"
        },
        {
          "title": "经济压力兜底",
          "desc": "本科奖学金+竞赛奖金覆盖备考；硕士奖助学金全覆盖；读博CSC全额资助实现经济独立"
        },
        {
          "title": "女生专属建议",
          "desc": "善用复合优势避开纯内卷；优先环境友好平台；公派选欧洲/新加坡/香港；积累同性人脉资源"
        }
      ]
    }
  ],
  "end": {
    "thanks": "低风险·高确定性·多通路进退，掌握人生主动权"
  }
}